Symbol,Name,Last Sale,Net Change,% Change,Market Cap,Country,IPO Year,Volume,Sector,Industry
CXP,Columbia Property Trust Inc. Common Stock,$14.01,-0.45,-3.112%,1603654734.00,United States,2013,730773,Consumer Services,Real Estate Investment Trusts
CXW,CoreCivic Inc. Common Stock,$6.83,-0.20,-2.845%,817101695.00,United States,,1539081,Consumer Services,Real Estate Investment Trusts
CYAD,Celyad SA American Depositary Shares,$7.91,0.5191,7.024%,110283941.00,Belgium,2015,58115,Health Care,Major Pharmaceuticals
CYAN,Cyanotech Corporation Common Stock,$2.97,-0.07,-2.303%,18108307.00,United States,,38370,Consumer Durables,Specialty Chemicals
CYBE,CyberOptics Corporation Common Stock,$24.28,-1.26,-4.933%,176143728.00,United States,1987,111166,Capital Goods,Electronic Components
CYBR,CyberArk Software Ltd. Ordinary Shares,$159.65,-4.31,-2.629%,6183462422.00,Israel,2014,616654,Technology,Computer Software: Prepackaged Software
CYCC,Cyclacel Pharmaceuticals Inc. Common Stock,$8.18,-0.75,-8.399%,39787389.00,United States,,533904,Health Care,Major Pharmaceuticals
CYCCP,Cyclacel Pharmaceuticals Inc. 6% Convertible Preferred Stock,$6.94,0.00,0.00%,0.00,United States,,21,Health Care,Major Pharmaceuticals
CYCN,Cyclerion Therapeutics Inc. Common Stock,$3.00,0.01,0.334%,101885604.00,United States,,201489,Health Care,Major Pharmaceuticals
CYD,China Yuchai International Limited Common Stock,$15.76,-0.38,-2.354%,643926666.00,Singapore,1994,54445,Energy,Industrial Machinery/Components
CYH,Community Health Systems Inc. Common Stock,$7.28,-0.05,-0.682%,870840531.00,United States,2000,849004,Health Care,Hospital/Nursing Management
CYRN,CYREN Ltd. Ordinary Shares,$1.08,0.08,8.00%,65793063.00,United States,,434219,Technology,Computer Software: Prepackaged Software
CYRX,CryoPort Inc. Common Stock,$42.84,-1.03,-2.348%,1699193336.00,United States,,668192,Health Care,Major Pharmaceuticals
CYTH,Cyclo Therapeutics Inc. Common Stock,$4.34,-0.33,-7.066%,18227245.00,United States,,357984,Basic Industries,Major Chemicals
CYTHW,Cyclo Therapeutics Inc. Warrant,$1.10,-0.18,-14.063%,0.00,United States,,19211,Basic Industries,Major Chemicals
CYTK,Cytokinetics Incorporated Common Stock,$20.60,-0.35,-1.671%,1458047874.00,United States,2004,542200,Health Care,Major Pharmaceuticals
CZNC,Citizens & Northern Corp Common Stock,$19.21,-0.14,-0.724%,305253681.00,United States,,21919,Finance,Major Banks
CZR,Caesars Entertainment Inc. Common Stock,$73.37,-0.27,-0.367%,15281293615.00,United States,,1318926,Consumer Services,Hotels/Resorts
CZWI,Citizens Community Bancorp Inc. Common Stock,$10.89,-0.11,-1.00%,121473191.00,United States,,11504,Finance,Savings Institutions
CZZ,Cosan Limited Class A Common Stock,$18.30,0.29,1.61%,4088509762.00,Brazil,,343226,Consumer Non-Durables,Specialty Foods
D,Dominion Energy Inc. Common Stock,$73.88,0.18,0.244%,60272714739.00,United States,,3718697,Public Utilities,Electric Utilities: Central
DAC,Danaos Corporation Common Stock,$20.33,-0.70,-3.329%,415749334.00,Greece,2006,315679,Transportation,Marine Transportation
DADA,Dada Nexus Limited American Depositary Shares,$35.84,-1.25,-3.37%,8372479933.00,China,2020,1298500,Technology,Computer Software: Programming Data Processing
DAIO,Data I/O Corporation Common Stock,$4.41,-0.14,-3.077%,37116037.00,United States,1981,20477,Capital Goods,Electrical Products
DAKT,Daktronics Inc. Common Stock,$4.67,-0.07,-1.477%,209992999.00,United States,1994,239712,Consumer Durables,Miscellaneous manufacturing industries
DAL,Delta Air Lines Inc. Common Stock,$40.03,-0.12,-0.299%,25528504069.00,United States,,8120808,Transportation,Air Freight/Delivery Services
DAN,Dana Incorporated Common Stock ,$18.91,-0.39,-2.021%,2732328819.00,United States,,932095,Capital Goods,Auto Parts:O.E.M.
DAO,Youdao Inc. American Depositary Shares each representing one Class A Ordinary Share,$25.76,0.22,0.861%,2879137395.00,,2019,263858,Consumer Services,Other Consumer Services
DAR,Darling Ingredients Inc. Common Stock,$56.30,-0.20,-0.354%,9124455649.00,United States,,1174394,Consumer Non-Durables,Packaged Foods
DARE,Dare Bioscience Inc. Common Stock,$1.24,-0.07,-5.344%,47107601.00,United States,2014,966728,Health Care,Major Pharmaceuticals
DASH,DoorDash Inc. Class A Common Stock,$141.27,-6.62,-4.476%,44875336722.00,,2020,3846787,Miscellaneous,Business Services
DAUG,FT Cboe Vest U.S. Equity Deep Buffer ETF - August,$33.0798,-0.0002,-0.001%,,United States,2019,47835,,
DAVA,Endava plc American Depositary Shares (each representing one Class A Ordinary Share),$74.88,-2.94,-3.778%,4127186794.00,,2018,111573,Technology,EDP Services
DB,Deutsche Bank AG Common Stock,$10.94,-0.25,-2.234%,22585630000.00,Germany,,2174594,Finance,Major Banks
DBD,Diebold Nixdorf Incorporated Common Stock,$10.82,-0.31,-2.785%,840480537.00,United States,,677395,Miscellaneous,Office Equipment/Supplies/Services
DBDR,Roman DBDR Tech Acquisition Corp. Class A Common Stock,$10.11,-0.09,-0.882%,292633950.00,United States,2020,19994,Finance,Business Services
DBDRU,Roman DBDR Tech Acquisition Corp. Unit,$10.70,-0.12,-1.109%,0.00,United States,2020,187783,Finance,Business Services
DBDRW,Roman DBDR Tech Acquisition Corp. Warrant,$1.20,-0.05,-4.00%,0.00,United States,2020,179375,Finance,Business Services
DBI,Designer Brands Inc. Class A Common Stock,$7.65,-0.22,-2.795%,553805509.00,United States,,1651770,Consumer Services,Clothing/Shoe/Accessory Stores
DBL,DoubleLine Opportunistic Credit Fund Common Shares of Beneficial Interest,$19.37,0.25,1.308%,289715076.00,United States,2012,45591,,
DBOC,Innovator Double Stacker 9 Buffer ETF - October,$27.1218,-0.0282,-0.104%,0.00,,2020,2123,,
DBVT,DBV Technologies S.A. American Depositary Shares,$2.50,-0.04,-1.575%,274075935.00,France,2014,729458,Health Care,Biotechnology: Biological Products (No Diagnostic Substances)
DBX,Dropbox Inc. Class A Common Stock,$22.93,-0.67,-2.839%,9484243267.00,United States,2018,5616161,Technology,Computer Software: Prepackaged Software
DCBO,Docebo Inc. Common Shares,$60.29,1.51,2.569%,1965165030.00,Canada,,18049,Technology,Computer Software: Prepackaged Software
DCF,BNY Mellon Alcentra Global Credit Income 2024 Target Term Fund Inc. Common Stock,$8.44,-0.0299,-0.353%,126288834.00,,2017,58863,,
DCI,Donaldson Company Inc. Common Stock,$55.97,-0.68,-1.20%,7065648266.00,United States,,452648,Capital Goods,Pollution Control Equipment
DCO,Ducommun Incorporated Common Stock,$53.85,-0.94,-1.716%,630830672.00,United States,,38247,Capital Goods,Military/Government/Technical
DCOM,Dime Community Bancshares Inc. Common Stock,$15.52,-0.48,-3.00%,512902818.00,United States,,56291,Finance,Savings Institutions
DCOMP,Dime Community Bancshares Inc. 5.50% Fixed-Rate Non-Cumulative Perpetual Preferred Stock Series A,$25.60,-0.165,-0.64%,0.00,United States,,10424,Finance,Savings Institutions
DCP,DCP Midstream  LP Common Units ,$18.81,-0.38,-1.98%,3919092242.00,United States,,519872,Public Utilities,Natural Gas Distribution
DCP.PRB,DCP Midstream LP,NA,,,,,,0,,
DCP.PRC,DCP Midstream LP,NA,,,,,,0,,
DCPH,Deciphera Pharmaceuticals Inc. Common Stock,$55.44,-2.14,-3.717%,3156389027.00,United States,2017,212082,Health Care,Major Pharmaceuticals
DCRB,Decarbonization Plus Acquisition Corporation Class A Common Stock,$10.60,-0.10,-0.935%,300218521.00,United States,2020,82889,Finance,Business Services
DCRBU,Decarbonization Plus Acquisition Corporation Unit,$11.50,-0.03,-0.26%,0.00,United States,2020,43431,Finance,Business Services
DCRBW,Decarbonization Plus Acquisition Corporation Warrant,$1.8504,-0.0995,-5.103%,0.00,United States,2020,31993,Finance,Business Services
DCT,Duck Creek Technologies Inc. Common Stock,$42.39,-1.56,-3.549%,5546012990.00,United States,2020,409562,Technology,Computer Software: Prepackaged Software
DCTH,Delcath Systems Inc. Common Stock,$16.90,0.22,1.319%,97948767.00,United States,,83701,Health Care,Medical/Dental Instruments
DCUE,Dominion Energy Inc. 2019 Series A Corporate Units,$98.22,-1.73,-1.731%,0.00,United States,2019,49541,Public Utilities,Electric Utilities: Central
DD,DuPont de Nemours Inc. Common Stock,$69.31,0.66,0.961%,50863116123.00,,2017,5159493,Basic Industries,Major Chemicals
DDD,3D Systems Corporation Common Stock,$10.15,-1.07,-9.537%,1260040640.00,United States,,4492292,Technology,Computer Software: Prepackaged Software
DDEC,FT Cboe Vest U.S. Equity Deep Buffer ETF - December,$30.43,-0.012,-0.039%,,United States,2020,116281,,
DDF,Delaware Investments Dividend & Income Fund Inc. Common Stock,$9.32,0.06,0.648%,71653633.00,United States,1993,20610,,
DDI,DoubleDown Interactive Co. Ltd.,NA,,,,,,0,,
DDMXU,DD3 Acquisition Corp. II Unit,$10.41,-0.0749,-0.714%,0.00,Mexico,2020,109173,Finance,Business Services
DDOG,Datadog Inc. Class A Common Stock,$98.92,-1.30,-1.297%,30124339963.00,United States,2019,2267306,Technology,Computer Software: Prepackaged Software
DDS,Dillard's Inc. Common Stock,$61.50,-0.51,-0.822%,1352870358.00,United States,,240018,Consumer Services,Department/Specialty Retail Stores
DDT,Dillard's Capital Trust I,$25.00,0.04,0.16%,0.00,United States,,14090,Consumer Services,Department/Specialty Retail Stores
DE,Deere & Company Common Stock,$265.34,-2.16,-0.807%,83147287873.00,United States,,892835,Capital Goods,Industrial Machinery/Components
DEA,Easterly Government Properties Inc. Common Stock,$22.43,-0.13,-0.576%,1822019517.00,United States,2015,295119,Consumer Services,Real Estate Investment Trusts
DECK,Deckers Outdoor Corporation Common Stock,$287.45,-3.48,-1.196%,8072763047.00,United States,1993,241876,Consumer Non-Durables,Shoe Manufacturing
DECZ,TrueShares Structured Outcome (December) ETF,$25.2918,-0.0308,-0.122%,,United States,2020,35,,
DEFN,Emles Trust Emles Protective Allocation ETF,$24.9126,-0.0508,-0.203%,,,2020,0,,
DEH,D8 Holdings Corp. Class A Ordinary Shares,$10.11,-0.03,-0.296%,435993750.00,Hong Kong,2020,63940,Finance,Business Services
DEH.U,D8 Holdings Corp. Units each consisting of one Class A ordinary share and one-half of one redeemable warrant,NA,,,,Hong Kong,2020,0,,
DEH.WS,D8 Holdings Corp. Warrants each whole warrant exercisable for one Class A ordinary share at an exercise price of $11.50 per share,NA,,,,Hong Kong,,0,,
DEI,Douglas Emmett Inc. Common Stock,$28.88,-0.73,-2.465%,5064826708.00,United States,2006,519048,Consumer Services,Real Estate Investment Trusts
DELL,Dell Technologies Inc. Class C Common Stock ,$71.50,-1.35,-1.853%,53611013027.00,,2018,4156620,Technology,Computer Manufacturing
DEN,Denbury Inc. Common Stock,$25.18,0.19,0.76%,1258999975.00,,2020,323524,Energy,Oil & Gas Production
DENN,Denny's Corporation Common Stock,$13.67,0.13,0.96%,871710200.00,United States,,752474,Consumer Services,Restaurants
DEO,Diageo plc Common Stock,$163.22,3.40,2.127%,95434715393.00,United Kingdom,,461866,Consumer Non-Durables,Beverages (Production/Distribution)
DESP,Despegar.com Corp. Ordinary Shares,$12.32,0.20,1.65%,861734720.00,,2017,226159,Consumer Services,Transportation Services
DEX,Delaware Enhanced Global Dividend Common Shares of Beneficial Interest,$9.68,-0.03,-0.309%,116231012.00,United States,2007,30242,,
DFEB,FT Cboe Vest U.S. Equity Deep Buffer ETF - February,$32.22,-0.07,-0.217%,,United States,2020,67824,,
DFFN,Diffusion Pharmaceuticals Inc. Common Stock,$0.7603,-0.0297,-3.759%,48670940.00,United States,,749752,Health Care,Major Pharmaceuticals
DFHT,Deerfield Healthcare Technology Acquisitions Corp. Class A Common Stock,$14.90,-0.37,-2.423%,267734375.00,United States,2020,120195,Finance,Business Services
DFHTU,Deerfield Healthcare Technology Acquisitions Corp. Unit,$15.33,-0.42,-2.667%,0.00,United States,2020,47993,Finance,Business Services
DFHTW,Deerfield Healthcare Technology Acquisitions Corp. Warrant,$3.59,-0.40,-10.025%,0.00,United States,2020,11203,Finance,Business Services
DFHY,TrimTabs Donoghue Forlines Tactical High Yield ETF,$25.2051,-0.0019,-0.008%,,,2020,3540,,
DFIN,Donnelley Financial Solutions Inc. Common Stock ,$17.15,-0.40,-2.279%,572387596.00,,2016,188436,Consumer Services,Other Consumer Services
DFNS,LGL Systems Acquisition Corp. Common Stock,$10.30,-0.13,-1.246%,222093750.00,United States,2020,86808,Finance,Business Services
DFNS.U,LGL Systems Acquisition Corp. Units,NA,,,,United States,2020,0,,
DFNS.WS,LGL Systems Acquisition Corp. Redeemable Warrants each whole warrant exercisable for shares of Class A Common Stock at an exercise price of $11.50 per share,NA,,,,United States,,0,,
DFNV,TrimTabs Donoghue Forlines Risk Managed Innovation ETF,$25.8382,-0.0892,-0.344%,,,2020,18346,,
DFP,Flaherty & Crumrine Dynamic Preferred and Income Fund Inc. Common Stock,$28.96,0.00,0.00%,555214141.00,,2013,37798,,
DFPH,DFP Healthcare Acquisitions Corp. Class A Common Stock,$10.87,0.02,0.184%,312512500.00,United States,2020,61870,Finance,Business Services
DFPHU,DFP Healthcare Acquisitions Corp. Unit,$11.2102,0.00,0.00%,0.00,United States,2020,0,Finance,Business Services
DFPHW,DFP Healthcare Acquisitions Corp. Warrant,$2.00,0.00,0.00%,0.00,United States,2020,5861,Finance,Business Services
DFS,Discover Financial Services Common Stock,$88.02,-0.27,-0.306%,26977807143.00,United States,,1044620,Finance,Finance: Consumer Services
DG,Dollar General Corporation Common Stock,$211.34,0.95,0.452%,51778490840.00,United States,2009,1129844,Consumer Services,Department/Specialty Retail Stores
DGICA,Donegal Group Inc. Class A Common Stock,$14.295,0.015,0.105%,425590240.00,United States,,42068,Finance,Property-Casualty Insurers
DGICB,Donegal Group Inc. Class B Common Stock,$12.17,0.00,0.00%,362324814.00,United States,1986,104,Finance,Property-Casualty Insurers
DGII,Digi International Inc. Common Stock,$18.815,-0.485,-2.513%,557297816.00,United States,1989,141937,Technology,Computer Communications Equipment
DGLY,Digital Ally Inc. Common Stock,$2.50,-0.06,-2.344%,66931728.00,United States,,1636546,Technology,Radio And Television Broadcasting And Communications Equipment
DGNR,Dragoneer Growth Opportunities Corp. Class A Ordinary Shares,$13.74,-0.25,-1.787%,1185075000.00,United States,2020,131557,Finance,Business Services
DGNR.U,Dragoneer Growth Opportunities Corp. Units each consisting of one Class A ordinary share and one-fourth of one redeemable warrant,NA,,,,United States,2020,0,,
DGNR.WS,Dragoneer Growth Opportunities Corp. Redeemable warrants each whole warrant exercisable for one Class A ordinary share at an exercise price of $11.50,NA,,,,United States,,0,,
DGNS,Dragoneer Growth Opportunities Corp. II Class A Ordinary Shares,$11.75,-0.75,-6.00%,371065000.00,United States,2020,176646,Finance,Business Services
DGX,Quest Diagnostics Incorporated Common Stock,$118.40,-0.10,-0.084%,15956292506.00,United States,,970887,Health Care,Medical Specialities
DHC,Diversified Healthcare Trust Common Shares of Beneficial Interest,$4.08,-0.16,-3.774%,972135390.00,United States,,1269045,Consumer Services,Real Estate Investment Trusts
DHCNI,Diversified Healthcare Trust 5.625% Senior Notes due 2042,$23.10,0.29,1.271%,0.00,United States,,33107,Consumer Services,Real Estate Investment Trusts
DHCNL,Diversified Healthcare Trust 6.25% Senior Notes Due 2046,$23.88,0.13,0.547%,0.00,United States,,35212,Consumer Services,Real Estate Investment Trusts
DHF,BNY Mellon High Yield Strategies Fund Common Stock,$2.96,0.01,0.339%,215214756.00,United States,1998,2275916,,
DHI,D.R. Horton Inc. Common Stock,$69.99,-0.41,-0.582%,25520245480.00,United States,,2592707,Capital Goods,Homebuilding
DHIL,Diamond Hill Investment Group Inc. Class A Common Stock,$150.84,-1.48,-0.972%,477147043.00,United States,,7934,Finance,Investment Managers
DHR,Danaher Corporation Common Stock,$222.86,0.11,0.049%,158314722296.00,United States,,1733637,Capital Goods,Industrial Machinery/Components
DHR.PRA,Danaher Corporation,NA,,,,,,0,,
DHR.PRB,Danaher Corporation,NA,,,,,,0,,
DHT,DHT Holdings Inc.,$5.25,-0.01,-0.19%,896691222.00,Jersey,2005,1676709,Transportation,Marine Transportation
DHX,DHI Group Inc. Common Stock,$2.10,-0.04,-1.869%,110118343.00,United States,2007,107817,Miscellaneous,Business Services
DHY,Credit Suisse High Yield Bond Fund Common Stock,$2.28,-0.01,-0.437%,235996877.00,United States,1998,2363294,,
DIAX,Nuveen Dow 30SM Dynamic Overwrite Fund Common Shares of Beneficial Interest,$15.15,-0.04,-0.263%,550958732.00,,2014,107671,,
DIN,Dine Brands Global Inc. Common Stock,$58.35,-1.92,-3.186%,958034004.00,United States,,389205,Consumer Services,Restaurants
DIOD,Diodes Incorporated Common Stock,$67.53,-1.10,-1.603%,3514393761.00,United States,,204431,Technology,Semiconductors
DIS,Walt Disney Company (The) Common Stock,$177.30,-1.56,-0.872%,320998997060.00,United States,,6872027,Consumer Services,Services-Misc. Amusement & Recreation
DISCA,Discovery Inc. Series A Common Stock,$29.69,0.24,0.815%,14582312440.00,United States,,4271837,Consumer Services,Television Services
DISCB,Discovery Inc. Series B Common Stock,$31.68,0.49,1.571%,15559705561.00,United States,,1921,Consumer Services,Television Services
DISCK,Discovery Inc. Series C Common Stock,$25.96,0.14,0.542%,12750314279.00,United States,,1286064,Consumer Services,Television Services
DISH,DISH Network Corporation Class A Common Stock,$31.70,-0.23,-0.72%,16674468404.00,United States,1995,4086751,Consumer Services,Television Services
DIT,AMCON Distributing Company Common Stock,$107.51,0.01,0.009%,59284992.00,United States,,969,Consumer Non-Durables,Food Distributors
DJCO,Daily Journal Corp. (S.C.) Common Stock,$374.52,24.52,7.006%,517116992.00,United States,,9989,Consumer Services,Newspapers/Magazines
DJUL,FT Cboe Vest U.S. Equity Deep Buffer ETF - July,$31.66,-0.04,-0.126%,,United States,2020,0,,
DJUN,FT Cboe Vest U.S. Equity Deep Buffer ETF - June,$32.3554,-0.0394,-0.122%,,United States,2020,1217,,
DK,Delek US Holdings Inc. Common Stock,$15.53,0.19,1.239%,1144961022.00,United States,2017,854124,Energy,Integrated oil Companies
DKL,Delek Logistics Partners L.P. Common Units representing Limited Partner Interests,$31.65,1.59,5.289%,1374662014.00,United States,2012,85844,Energy,Natural Gas Distribution
DKNG,DraftKings Inc. Class A Common Stock,$48.11,-0.85,-1.736%,18845352169.00,United States,2019,13372642,Consumer Services,Services-Misc. Amusement & Recreation
DKS,Dick's Sporting Goods Inc Common Stock,$56.09,-1.16,-2.026%,5025589681.00,United States,2002,1656348,Consumer Services,Other Specialty Stores
DL,China Distance Education Holdings Limited American Depositary Shares,$9.75,0.16,1.668%,333322275.00,China,,47483,Consumer Services,Other Consumer Services
DLA,Delta Apparel Inc. Common Stock,$19.53,-0.40,-2.007%,136215110.00,United States,,11603,Consumer Non-Durables,Apparel
DLB,Dolby Laboratories Common Stock,$95.50,-0.67,-0.697%,9639273496.00,United States,2005,293524,Miscellaneous,Multi-Sector Companies
DLHC,DLH Holdings Corp.,$9.32,0.02,0.215%,116797364.00,United States,,43512,Technology,Professional Services
DLNG,Dynagas LNG Partners LP Common Units,$2.39,0.00,0.00%,85114066.00,Greece,,75705,Consumer Services,Marine Transportation
DLNG.PRA,Dynagas LNG Partners LP,NA,,,,,,0,,
DLNG.PRB,Dynagas LNG Partners LP,NA,,,,,,0,,
DLPN,Dolphin Entertainment Inc. Common Stock,$3.25,-0.16,-4.692%,21321112.00,United States,,113371,Consumer Services,Other Consumer Services
DLR,Digital Realty Trust Inc. Common Stock,$138.00,-0.61,-0.44%,38662795254.00,United States,2004,1009159,Consumer Services,Real Estate Investment Trusts
DLR.PRC,Digital Realty Trust Inc.,NA,,,,,,0,,
DLR.PRJ,Digital Realty Trust Inc.,NA,,,,,,0,,
DLR.PRK,Digital Realty Trust Inc.,NA,,,,,,0,,
DLR.PRL,Digital Realty Trust Inc.,NA,,,,,,0,,
DLTH,Duluth Holdings Inc. Class B Common Stock,$10.48,-0.26,-2.421%,344039494.00,United States,2015,269398,Consumer Services,Clothing/Shoe/Accessory Stores
DLTR,Dollar Tree Inc. Common Stock,$109.10,1.17,1.084%,25659463783.00,United States,1995,1681244,Consumer Services,Department/Specialty Retail Stores
DLX,Deluxe Corporation Common Stock,$27.74,0.81,3.008%,1162139227.00,United States,,331824,Consumer Durables,Publishing
DLY,DoubleLine Yield Opportunities Fund Common Shares of Beneficial Interest,$18.57,-0.03,-0.161%,0.00,,2020,385381,,
DM,Desktop Metal Inc. Class A Common Stock,$17.10,-1.83,-9.667%,3876655175.00,,2019,2630590,Technology,Industrial Machinery/Components
DM.WS,Desktop Metal Inc. Warrants,NA,,,,,,0,,
DMAC,DiaMedica Therapeutics Inc. Common Stock,$9.33,-0.21,-2.201%,174835560.00,United States,2018,245387,Health Care,Major Pharmaceuticals
DMAY,FT Cboe Vest U.S. Equity Deep Buffer ETF - May,$32.6951,-0.0299,-0.091%,,United States,2020,874,,
DMB,BNY Mellon Municipal Bond Infrastructure Fund Inc. Common Stock,$13.95,0.00,0.00%,256506643.00,,2013,42151,,
DMF,BNY Mellon Municipal Income Inc. Common Stock,$8.74,0.04,0.46%,181361975.00,United States,1988,40493,,
DMLP,Dorchester Minerals L.P. Common Units Representing Limited Partnership Interests,$11.00,-0.06,-0.542%,381477514.00,United States,,140465,Energy,Oil & Gas Production
DMO,Western Asset Mortgage Opportunity Fund Inc. Common Stock,$14.08,-0.03,-0.213%,154655818.00,United States,2010,57335,,
DMRC,Digimarc Corporation Common Stock,$47.03,-3.36,-6.668%,720295631.00,United States,,158141,Technology,EDP Services
DMS,Digital Media Solutions Inc. Class A Ordinary Shares,$11.90,0.29,2.498%,694865288.00,United States,2018,128652,Miscellaneous,Business Services
DMS.WS,Digital Media Solutions Inc. Warrants ,NA,,,,United States,,0,,
DMTK,DermTech Inc. Common Stock,$28.01,2.63,10.362%,548864521.00,United States,2017,1371913,Health Care,Medical Specialities
DMYD,dMY Technology Group Inc. II Class A Common Stock,$16.64,0.21,1.278%,574080000.00,United States,2020,1146683,Finance,Business Services
DMYD.U,dMY Technology Group Inc. II Units each consisting of one share of Class A common stock and one-third of one redeemable warrant,NA,,,,United States,2020,0,,
DMYD.WS,dMY Technology Group Inc. II Redeemable Warrants,NA,,,,United States,,0,,
DMYI.U,dMY Technology Group Inc. III Units each consisting of one share of Class A common stock and one-fourth of one redeemable warrant,NA,,,,United States,2020,0,,
DMYT,dMY Technology Group Inc. Class A Common Stock,$22.76,-1.52,-6.26%,654350000.00,,2020,1322193,Consumer Services,Services-Misc. Amusement & Recreation
DMYT.U,dMY Technology Group Inc. Units each consisting of one share of Class A Common Stock and one-half of one redeemable Warrant,NA,,,,,2020,0,,
DMYT.WS,dMY Technology Group Inc. Redeemable Warrants each whole warrant exercisable for one share of Class A Common Stock each at an exercise price of $11.50 per share,NA,,,,,,0,,
DNB,Dun & Bradstreet Holdings Inc. Common Stock,$25.87,-0.38,-1.448%,10944021232.00,United States,2020,739220,Finance,Finance: Consumer Services
DNK,Phoenix Tree Holdings Limited American Depositary Shares each representing ten (10) Class A ordinary shares,$3.04,-0.06,-1.935%,555955200.00,,2020,179528,Consumer Services,Building operators
DNLI,Denali Therapeutics Inc. Common Stock,$84.00,-1.77,-2.064%,10073153664.00,United States,2017,380264,Health Care,Biotechnology: Biological Products (No Diagnostic Substances)
DNN,Denison Mines Corp Ordinary Shares (Canada),$0.70,-0.0193,-2.683%,474367896.00,Canada,,4626342,Basic Industries,Precious Metals
DNOV,FT Cboe Vest U.S. Equity Deep Buffer ETF - November,$33.17,-0.21,-0.629%,,United States,2019,3023,,
DNOW,NOW Inc. Common Stock,$6.97,-0.15,-2.107%,762376000.00,,2014,1454170,Energy,Metal Fabrications
DNP,DNP Select Income Fund Inc. Common Stock,$10.32,0.01,0.097%,3134625975.00,United States,1987,595622,,
DOC,Physicians Realty Trust Common Shares of Beneficial Interest,$17.88,-0.19,-1.051%,3723147966.00,United States,2013,1068338,Consumer Services,Real Estate Investment Trusts
DOCT,FT Cboe Vest U.S. Equity Deep Buffer ETF - October,$30.83,-0.035,-0.113%,,United States,2020,3454,,
DOCU,DocuSign Inc. Common Stock,$228.16,-1.04,-0.454%,42564826411.00,United States,2018,2681879,Technology,Computer Software: Prepackaged Software
DOGZ,Dogness (International) Corporation Class A Common Stock,$1.95,0.06,3.175%,50531580.00,China,2017,49216,Consumer Durables,Miscellaneous manufacturing industries
DOMO,Domo Inc. Class B Common Stock,$64.90,-2.72,-4.022%,1943707428.00,United States,2018,295374,Technology,Computer Software: Prepackaged Software
DOOO,BRP Inc. (Recreational Products) Common Subordinate Voting Shares,$65.09,0.73,1.134%,5722721262.00,Canada,,53146,Capital Goods,Industrial Specialties
DOOR,Masonite International Corporation Ordinary Shares (Canada),$98.04,-0.87,-0.88%,2402270885.00,Canada,,117770,Basic Industries,Forest Products
DORM,Dorman Products Inc. Common Stock,$88.03,-1.54,-1.719%,2842197937.00,United States,,102111,Capital Goods,Auto Parts:O.E.M.
DOV,Dover Corporation Common Stock,$123.51,-0.77,-0.62%,17798198459.00,United States,,626791,Technology,Industrial Machinery/Components
DOW,Dow Inc. Common Stock ,$54.33,0.04,0.074%,40299373229.00,,2019,2221163,Basic Industries,Major Chemicals
DOX,Amdocs Limited Ordinary Shares,$69.97,-0.54,-0.766%,9173779435.00,Guernsey,,448971,Technology,EDP Services
DOYU,DouYu International Holdings Limited ADS,$11.11,0.11,1.00%,3565716171.00,China,2019,2452902,Technology,Computer Software: Programming Data Processing
DPG,Duff & Phelps Utility and Infrastructure Fund Inc.,$11.97,-0.11,-0.911%,454019778.00,United States,2011,334379,,
DPW,DPW Holdings Inc. Common Stock,$4.63,-0.38,-7.585%,85598986.00,United States,,12610301,Capital Goods,Industrial Machinery/Components
DPZ,Domino's Pizza Inc Common Stock,$384.36,-15.82,-3.953%,15143747870.00,United States,2004,928822,Consumer Non-Durables,Food Distributors
DQ,DAQO New Energy Corp. American Depositary Shares each representing five ordinary shares,$55.79,-0.86,-1.518%,3876502876.00,China,2010,1717724,Technology,Semiconductors
