Symbol,Name,Last Sale,Net Change,% Change,Market Cap,Country,IPO Year,Volume,Sector,Industry
PTE,PolarityTE Inc. Common Stock,$0.6778,0.0178,2.697%,30291779.00,United States,,2402010,Health Care,Biotechnology: Biological Products (No Diagnostic Substances)
PTEN,Patterson-UTI Energy Inc. Common Stock,$5.21,-0.04,-0.762%,976842568.00,United States,1993,1054585,Energy,Oil & Gas Production
PTGX,Protagonist Therapeutics Inc. Common Stock,$21.37,-1.68,-7.289%,919309534.00,United States,2016,600466,Health Care,Major Pharmaceuticals
PTICU,PropTech Investment Corporation II Unit,$10.45,-0.01,-0.096%,0.00,United States,2020,147650,Finance,Business Services
PTK,PTK Acquisition Corp. Common Stock,$10.142,-0.058,-0.569%,145791250.00,United States,2020,13390,Finance,Business Services
PTK.U,PTK Acquisition Corp. Units,NA,,,,United States,2020,0,,
PTK.WS,PTK Acquisition Corp. Warrants each whole warrant exercisable for one half (1/2) of a share of Common Stock at an exercise price of $11.50,NA,,,,United States,,0,,
PTMN,Portman Ridge Finance Corporation Common Stock,$1.71,0.01,0.588%,75529093.00,United States,,357269,,
PTN,Palatin Technologies Inc. Common Stock,$0.78,0.0109,1.417%,179323019.00,United States,,9735384,Health Care,Major Pharmaceuticals
PTNR,Partner Communications Company Ltd. American Depositary Shares,$5.31,-0.0673,-1.252%,975542081.00,Israel,,3271,Public Utilities,Telecommunications Equipment
PTON,Peloton Interactive Inc. Class A Common Stock,$150.10,-2.08,-1.367%,43909116993.00,United States,2019,9335401,Energy,Consumer Electronics/Appliances
PTPI,Petros Pharmaceuticals Inc. Common Stock,$4.40,-0.28,-5.983%,42714069.00,United States,,137685,Health Care,Major Pharmaceuticals
PTR,PetroChina Company Limited Common Stock,$30.97,-0.11,-0.354%,56681596825.00,China,,99335,Energy,Oil & Gas Production
PTRS,Partners Bancorp Common Stock,$6.52,0.02,0.308%,116122589.00,United States,,21272,Finance,Major Banks
PTSI,P.A.M. Transportation Services Inc. Common Stock,$45.49,-0.04,-0.088%,260862951.00,United States,1986,3108,Transportation,Trucking Freight/Courier Services
PTVCA,Protective Insurance Corporation Class A Common Stock,$14.6875,-0.3125,-2.083%,209529922.00,United States,,2287,Finance,Property-Casualty Insurers
PTVCB,Protective Insurance Corporation Class B Common Stock,$13.68,0.04,0.293%,195157061.00,United States,,48581,Finance,Property-Casualty Insurers
PTVE,Pactiv Evergreen Inc. Common stock,$17.76,-0.57,-3.11%,3146320930.00,United States,2020,356008,Consumer Durables,Containers/Packaging
PTY,Pimco Corporate & Income Opportunity Fund,$17.80,0.07,0.395%,1890381627.00,United States,2002,216904,,
PUBM,PubMatic Inc. Class A Common Stock,$26.31,-1.90,-6.735%,1258315320.00,United States,2020,386254,Technology,Computer Software: Programming Data Processing
PUK,Prudential Public Limited Company Common Stock,$37.18,0.45,1.225%,48510404414.00,United Kingdom,,151459,Finance,Life Insurance
PUK.PR,Prudential Public Limited Company,NA,,,,,,0,,
PUK.PRA,Prudential Public Limited Company,NA,,,,,,0,,
PULM,Pulmatrix Inc. Common Stock,$1.16,-0.03,-2.521%,39912680.00,United States,2014,799005,Health Care,Major Pharmaceuticals
PUMP,ProPetro Holding Corp. Common Stock,$7.41,-0.02,-0.269%,747763678.00,United States,2017,723069,Energy,Oilfield Services/Equipment
PUYI,Puyi Inc. American Depository Shares,$6.17,-0.01,-0.162%,372141551.00,China,2019,250,Finance,Investment Managers
PVAC,Penn Virginia Corporation Common Stock,$10.07,-0.36,-3.452%,153068380.00,United States,,366421,Energy,Oil & Gas Production
PVBC,Provident Bancorp Inc. (MD) Common Stock,$12.27,0.05,0.409%,238346480.00,United States,2015,25380,Finance,Savings Institutions
PVG,Pretium Resources Inc. Ordinary Shares (Canada),$11.24,-0.09,-0.794%,2104732071.00,Canada,,799160,Basic Industries,Precious Metals
PVH,PVH Corp. Common Stock,$93.44,-1.47,-1.549%,6643607360.00,United States,,428513,Consumer Non-Durables,Apparel
PVL,Permianville Royalty Trust Trust Units ,$0.70,-0.07,-9.091%,23100000.00,United States,2011,239282,Energy,Oil & Gas Production
PW,Power REIT (MD) Common Stock,$26.12,-0.65,-2.428%,50049551.00,United States,,20685,Consumer Services,Real Estate Investment Trusts
PW.PRA,Power REIT,NA,,,,,,0,,
PWFL,PowerFleet Inc. Common Stock,$7.28,-0.24,-3.191%,226414872.00,United States,,99424,Capital Goods,Telecommunications Equipment
PWOD,Penns Woods Bancorp Inc. Common Stock,$26.10,-0.37,-1.398%,184051536.00,United States,,9355,Finance,Major Banks
PWR,Quanta Services Inc. Common Stock,$70.62,-0.09,-0.127%,9806356758.00,United States,,593004,Capital Goods,Engineering & Construction
PXD,Pioneer Natural Resources Company Common Stock,$110.64,-0.01,-0.009%,18191262066.00,United States,,1320095,Energy,Oil & Gas Production
PXLW,Pixelworks Inc.  Common Stock,$2.79,0.00,0.00%,141930656.00,United States,2000,512677,Technology,Semiconductors
PXMD,PaxMedica Inc.,NA,,,,,,0,,
PXS,Pyxis Tankers Inc. Common Stock,$0.898,0.088,10.864%,19360777.00,Greece,,1602717,Transportation,Marine Transportation
PXSAP,Pyxis Tankers Inc. 7.75% Series A Cumulative Convertible Preferred Shares,$14.1999,0.0199,0.14%,0.00,Greece,,1205,Transportation,Marine Transportation
PXSAW,Pyxis Tankers Inc. Warrant,$0.231,-0.0057,-2.408%,0.00,Greece,,6778,Transportation,Marine Transportation
PYN,PIMCO New York Municipal Income Fund III Common Shares of Beneficial Interest,$8.76,-0.05,-0.568%,50178077.00,United States,2002,13986,,
PYPD,PolyPid Ltd. Ordinary Shares,$9.88,0.33,3.455%,182724119.00,Israel,2020,196998,Health Care,Medical/Dental Instruments
PYPL,PayPal Holdings Inc. Common Stock,$231.03,-4.70,-1.994%,270695958633.00,United States,,8310369,Miscellaneous,Business Services
PYS,Merrill Lynch Depositor Inc PPlus Tr Ser RRD-1 Tr Ctf Cl A,$20.86,1.6631,8.663%,0.00,United States,,363,Finance,Finance: Consumer Services
PYT,PPlus Tr GSC-2 Tr Ctf Fltg Rate,$23.55,0.05,0.213%,0.00,United States,,1236,Finance,Finance: Consumer Services
PZC,PIMCO California Municipal Income Fund III Common Shares of Beneficial Interest,$10.25,0.03,0.294%,229330794.00,United States,2002,51175,,
PZG,Paramount Gold Nevada Corp. Common Stock,$1.1999,0.1099,10.083%,41141798.00,United States,2015,578932,Basic Industries,Precious Metals
PZN,Pzena Investment Management Inc Class A Common Stock,$7.30,-0.04,-0.545%,519540759.00,United States,2007,98721,Finance,Investment Managers
PZZA,Papa John's International Inc. Common Stock,$85.52,-3.68,-4.126%,2818070776.00,United States,1993,360995,Consumer Services,Restaurants
QADA,QAD Inc. Class A Common Stock,$62.10,0.10,0.161%,1285412682.00,United States,,36908,Technology,Computer Software: Prepackaged Software
QADB,QAD Inc. Class B Common Stock,$47.2341,0.00,0.00%,977702273.00,United States,,252,Technology,Computer Software: Prepackaged Software
QCOM,QUALCOMM Incorporated Common Stock,$148.49,0.75,0.508%,167942190000.00,United States,1991,3541713,Technology,Radio And Television Broadcasting And Communications Equipment
QCRH,QCR Holdings Inc. Common Stock,$38.80,-1.13,-2.83%,612782252.00,United States,,32003,Finance,Major Banks
QD,Qudian Inc. American Depositary Shares each representing one Class A Ordinary Share,$1.18,-0.01,-0.84%,299400632.00,China,2017,2812511,Finance,Finance: Consumer Services
QDEC,FT Cboe Vest Growth-100 Buffer ETF - December,$20.0375,0.0106,0.053%,,United States,2020,158690,,
QDEL,Quidel Corporation Common Stock,$181.18,-2.06,-1.124%,7621816102.00,United States,,670052,Health Care,Biotechnology: In Vitro & In Vivo Diagnostic Substances
QELL,Qell Acquisition Corp. Class A Ordinary Shares,$12.38,-0.67,-5.134%,587276250.00,United States,2020,1237627,Finance,Business Services
QELLU,Qell Acquisition Corp. Unit,$13.11,-0.69,-5.00%,0.00,United States,2020,113962,Finance,Business Services
QELLW,Qell Acquisition Corp. Warrant,$3.38,-0.32,-8.649%,0.00,United States,2020,319183,Finance,Business Services
QEP,QEP Resources Inc. Common Stock,$2.33,-0.04,-1.688%,566040041.00,United States,,8749340,Energy,Oil & Gas Production
QFIN,360 DigiTech Inc. American Depositary Shares,$10.69,0.30,2.887%,1626072448.00,China,2018,903611,Finance,Finance: Consumer Services
QGEN,Qiagen N.V. Common Shares ,$52.66,0.17,0.324%,12045922340.00,Netherlands,,967617,Health Care,Biotechnology: Biological Products (No Diagnostic Substances)
QH,Quhuo Limited American Depository Shares,$7.21,0.15,2.125%,374245216.00,China,2020,145721,Miscellaneous,Business Services
QIWI,QIWI plc American Depositary Shares,$10.23,0.03,0.294%,641553734.00,Cyprus,2013,388520,Miscellaneous,Business Services
QK,Q&K International Group Limited American Depositary Shares,$2.79,-0.03,-1.064%,133549008.00,China,2019,91294,Finance,Real Estate
QLGN,Qualigen Therapeutics Inc. Common Stock,$3.01,-0.12,-3.834%,76549393.00,United States,2015,1768245,Health Care,Major Pharmaceuticals
QLYS,Qualys Inc. Common Stock,$118.75,-4.88,-3.947%,4633220181.00,United States,2012,384837,Technology,Computer Software: Prepackaged Software
QMCO,Quantum Corporation Common Stock,$5.64,-0.02,-0.353%,229774796.00,United States,,189734,Technology,Electronic Components
QNST,QuinStreet Inc. Common Stock,$21.51,-0.52,-2.36%,1137734431.00,United States,2010,205927,Miscellaneous,Business Services
QQQX,Nuveen NASDAQ 100 Dynamic Overwrite Fund Shares of Beneficial Interest,$25.88,0.14,0.544%,1059958749.00,United States,,119144,,
QRHC,Quest Resource Holding Corporation Common Stock,$2.17,-0.03,-1.364%,39887263.00,United States,,79979,Technology,Diversified Commercial Services
QRTEA,Qurate Retail Inc. Series A Common Stock ,$10.72,0.02,0.187%,4472614362.00,United States,,3512815,Consumer Services,Catalog/Specialty Distribution
QRTEB,Qurate Retail Inc. Series B Common Stock ,$10.795,0.035,0.325%,4503905974.00,United States,,3896,Consumer Services,Catalog/Specialty Distribution
QRTEP,Qurate Retail Inc. 8.0% Fixed Rate Cumulative Redeemable Preferred Stock,$98.21,-0.17,-0.173%,0.00,United States,,31694,Consumer Services,Catalog/Specialty Distribution
QRVO,Qorvo Inc. Common Stock,$163.77,-2.67,-1.604%,18678640285.00,United States,,936111,Technology,Semiconductors
QS,QuantumScape Corporation Class A Common Stock,$101.00,-14.20,-12.326%,36659146244.00,United States,2020,16848070,Miscellaneous,Industrial Machinery/Components
QS.WS,QuantumScape Corporation Warrants,NA,,,,United States,,0,,
QSR,Restaurant Brands International Inc. Common Shares,$60.80,0.24,0.396%,18429286147.00,Canada,2014,1106437,Consumer Services,Restaurants
QTNT,Quotient Limited Ordinary Shares,$5.36,-0.12,-2.19%,541476414.00,Switzerland,2014,836819,Health Care,Biotechnology: In Vitro & In Vivo Diagnostic Substances
QTRX,Quanterix Corporation Common Stock,$45.89,-2.17,-4.515%,1453252964.00,United States,2017,410022,Capital Goods,Biotechnology: Laboratory Analytical Instruments
QTS,QTS Realty Trust Inc. Class A Common Stock,$60.66,-0.54,-0.882%,3908657673.00,United States,2013,403604,Consumer Services,Real Estate Investment Trusts
QTS.PRA,QTS Realty Trust Inc.,NA,,,,,,0,,
QTS.PRB,QTS Realty Trust Inc.,NA,,,,,,0,,
QTT,Qutoutiao Inc. American Depositary Shares,$1.59,-0.03,-1.852%,424253423.00,China,2018,3299215,Technology,Computer Software: Programming Data Processing
QTWO,Q2 Holdings Inc. Common Stock,$125.57,-1.36,-1.071%,6766109531.00,,2014,233701,Technology,Computer Software: Prepackaged Software
QUAD,Quad Graphics Inc Class A Common Stock,$3.83,-0.09,-2.296%,205504433.00,United States,,213913,Miscellaneous,Publishing
QUIK,QuickLogic Corporation Common Stock,$3.57,-0.34,-8.696%,39514470.00,United States,1999,118990,Technology,Semiconductors
QUMU,Qumu Corporation Common Stock,$7.74,0.20,2.653%,106137420.00,United States,,81109,Technology,Computer Software: Prepackaged Software
QUOT,Quotient Technology Inc. Common Stock,$9.63,-0.12,-1.231%,876383524.00,,2014,310153,Consumer Services,Advertising
QURE,uniQure N.V. Ordinary Shares,$36.51,-0.54,-1.457%,1624554108.00,Netherlands,2014,433405,Health Care,Major Pharmaceuticals
QVCC,QVC Inc. 6.250% Senior Secured Notes due 2068,$25.25,-0.05,-0.198%,0.00,United States,2019,58487,Consumer Services,Catalog/Specialty Distribution
QVCD,QVC Inc. 6.375% Senior Secured Notes due 2067,$25.75,-0.095,-0.368%,0.00,United States,2018,7354,Consumer Services,Catalog/Specialty Distribution
R,Ryder System Inc. Common Stock,$62.68,-0.31,-0.492%,3377770230.00,United States,,323463,Consumer Services,Rental/Leasing Companies
RA,Brookfield Real Assets Income Fund Inc. Common Stock,$17.65,-0.13,-0.731%,774664024.00,,2016,163495,,
RAACU,Revolution Acceleration Acquisition Corp Unit,$10.44,0.07,0.675%,0.00,United States,2020,201748,Finance,Business Services
RACA,Therapeutics Acquisition Corp. Class A Common Stock,$13.855,-0.475,-3.315%,241546685.00,United States,2020,6352,Finance,Business Services
RACE,Ferrari N.V. Common Shares,$229.64,1.03,0.451%,56972492628.00,,2015,350312,Capital Goods,Auto Manufacturing
RAD,Rite Aid Corporation Common Stock,$16.55,-0.45,-2.647%,913958872.00,United States,,2553870,Health Care,Medical/Nursing Services
RADA,RADA Electronic Industries Ltd. Ordinary Shares,$9.76,-0.44,-4.314%,424414234.00,Israel,,482677,Technology,Electronic Components
RADI,Radius Global Infrastructure Inc. Class A Common Stock,$13.07,-0.12,-0.91%,763614750.00,United States,,295626,Consumer Services,Real Estate
RAIL,FreightCar America Inc. Common Stock,$2.32,-0.31,-11.787%,36040803.00,United States,2005,507463,Capital Goods,Railroads
RAMP,LiveRamp Holdings Inc. Common Stock,$73.27,0.01,0.014%,4858720758.00,United States,2018,438427,Technology,EDP Services
RAND,Rand Capital Corporation Common Stock,$21.25,3.18,17.598%,54905155.00,United States,,66090,Finance,Finance: Consumer Services
RAPT,RAPT Therapeutics Inc. Common Stock,$19.92,-0.21,-1.043%,489140759.00,United States,2019,298610,Health Care,Major Pharmaceuticals
RARE,Ultragenyx Pharmaceutical Inc. Common Stock,$147.44,-22.45,-13.214%,9754010857.00,United States,2014,1310299,Health Care,Major Pharmaceuticals
RAVE,Rave Restaurant Group Inc. Common Stock,$0.8972,-0.0328,-3.527%,16154000.00,United States,,390208,Consumer Non-Durables,Food Distributors
RAVN,Raven Industries Inc. Common Stock,$32.65,-1.09,-3.231%,1170626080.00,United States,,195978,Capital Goods,Specialty Chemicals
RBA,Ritchie Bros. Auctioneers Incorporated Common Stock,$69.18,-1.17,-1.663%,7589898436.00,Canada,,309110,Miscellaneous,Business Services
RBAC,RedBall Acquisition Corp. Class A Ordinary Shares,$10.98,-0.01,-0.091%,789187500.00,United States,2020,334386,Finance,Business Services
RBAC.U,RedBall Acquisition Corp. Units each consisting of one Class A ordinary share and one-third of one redeemable warrant,NA,,,,United States,2020,0,,
RBAC.WS,RedBall Acquisition Corp. Redeemable warrants each whole warrant exercisable for one Class A ordinary share at an exercise price of $11.50 per share,NA,,,,United States,,0,,
RBB,RBB Bancorp Common Stock,$15.61,0.04,0.257%,307815042.00,United States,2017,50455,Finance,Major Banks
RBBN,Ribbon Communications Inc. Common Stock,$6.48,-0.07,-1.069%,942170169.00,United States,,238386,Technology,EDP Services
RBC,Regal Beloit Corporation Common Stock,$121.58,-0.66,-0.54%,4935574386.00,United States,,332709,Consumer Durables,Metal Fabrications
RBCAA,Republic Bancorp Inc. Class A Common Stock,$35.82,-0.48,-1.322%,749199371.00,United States,1998,22351,Finance,Major Banks
RBCN,Rubicon Technology Inc. Common Stock,$9.33,0.0798,0.863%,22595599.00,United States,2007,2009,Technology,Semiconductors
RBKB,Rhinebeck Bancorp Inc. Common Stock,$8.57,0.04,0.469%,95412295.00,United States,2019,12608,Finance,Banks
RBNC,Reliant Bancorp Inc. Common Stock,$18.56,-0.24,-1.277%,302484867.00,United States,,19888,Finance,Major Banks
RC,Ready Capital Corproation Common Stock,$12.80,-0.15,-1.158%,697172237.00,United States,2013,471060,Consumer Services,Real Estate Investment Trusts
RCA,Ready Capital Corporation 7.00% Convertible Senior Notes due 2023,$24.60,-0.09,-0.365%,0.00,United States,2017,7395,Consumer Services,Real Estate Investment Trusts
RCB,Ready Capital Corporation 6.20% Senior Notes due 2026,$24.30,0.10,0.413%,0.00,United States,2019,3292,Consumer Services,Real Estate Investment Trusts
RCEL,Avita Therapeutics Inc. Common Stock,$19.02,0.22,1.17%,411274919.00,Australia,,109249,Health Care,Medical/Dental Instruments
RCG,RENN Fund Inc Common Stock,$1.62,-0.0551,-3.289%,9642169.00,United States,,26801,,
RCHG,Recharge Acquisition Corp. Class A Common Stock,$10.10,-0.03,-0.296%,260075000.00,United States,2020,65911,Finance,Business Services
RCHGU,Recharge Acquisition Corp. Unit,$10.60,-0.25,-2.304%,0.00,United States,2020,19717,Finance,Business Services
RCHGW,Recharge Acquisition Corp. Warrant,$1.59,-0.28,-14.973%,0.00,United States,2020,55613,Finance,Business Services
RCI,Rogers Communication Inc. Common Stock,$46.82,0.08,0.171%,23640603389.00,Canada,,152843,Consumer Services,Television Services
RCII,Rent-A-Center Inc. Common Stock,$37.93,-0.24,-0.629%,2056024098.00,United States,1995,434432,Technology,Diversified Commercial Services
RCKT,Rocket Pharmaceuticals Inc. Common Stock,$55.84,-0.48,-0.852%,3343512471.00,United States,2015,611302,Health Care,Major Pharmaceuticals
RCKY,Rocky Brands Inc. Common Stock,$28.08,-0.19,-0.672%,203367462.00,United States,1993,17814,Consumer Non-Durables,Shoe Manufacturing
RCL,D/B/A Royal Caribbean Cruises Ltd. Common Stock,$71.60,-1.29,-1.77%,16062695240.00,United States,1993,3455749,Consumer Services,Marine Transportation
RCM,R1 RCM Inc. Common Stock,$23.88,-0.05,-0.209%,2785898637.00,United States,,726348,Consumer Services,Other Consumer Services
RCMT,RCM Technologies Inc. Common Stock,$2.33,-0.10,-4.115%,26710316.00,United States,,859770,Technology,Professional Services
RCON,Recon Technology Ltd. Ordinary Shares,$1.31,-0.09,-6.429%,9435710.00,China,2009,270551,Energy,Oilfield Services/Equipment
RCP,Ready Capital Corporation 6.50% Senior Notes due 2021,$25.32,0.00,0.00%,0.00,United States,2018,3616,Consumer Services,Real Estate Investment Trusts
RCS,PIMCO Strategic Income Fund Inc.,$6.87,-0.05,-0.723%,301840320.00,United States,1994,242814,,
RCUS,Arcus Biosciences Inc. Common Stock,$27.54,-0.99,-3.47%,1787987792.00,,2018,344634,Health Care,Major Pharmaceuticals
RDCM,Radcom Ltd. Ordinary Shares,$10.45,0.10,0.966%,145711205.00,Israel,1997,5423,Technology,Computer peripheral equipment
RDFI,Rareview Dynamic Fixed Income ETF,$26.6811,-0.1391,-0.519%,,,2020,10,,
RDFN,Redfin Corporation Common Stock,$72.34,-1.12,-1.525%,7403565756.00,United States,2017,1282769,Finance,Real Estate
RDHL,Redhill Biopharma Ltd. American Depositary Shares,$8.96,-0.57,-5.981%,337746349.00,Israel,,296624,Health Care,Major Pharmaceuticals
RDI,Reading International Inc Class A Common Stock,$5.11,0.08,1.59%,111138397.00,United States,,50790,Consumer Services,Movies/Entertainment
RDIB,Reading International Inc Class B Common Stock,$21.76,0.00,0.00%,473262527.00,United States,,111,Consumer Services,Movies/Entertainment
RDN,Radian Group Inc. Common Stock,$19.81,-0.31,-1.541%,3794735612.00,United States,,688101,Finance,Property-Casualty Insurers
RDNT,RadNet Inc. Common Stock,$19.05,-0.05,-0.262%,983667686.00,United States,,165333,Health Care,Medical Specialities
RDS.A,Royal Dutch Shell PLC Royal Dutch Shell American Depositary Shares (Each representing two Class A Ordinary Shares),NA,,,,,,0,,
RDS/B,Royal Dutch Shell PLC,$34.40,0.28,0.821%,,Netherlands,,2617180,,
RDUS,Radius Health Inc. Common Stock,$18.29,-0.09,-0.49%,851351708.00,United States,2014,427158,Health Care,Major Pharmaceuticals
RDVT,Red Violet Inc. Common Stock ,$25.82,-0.24,-0.921%,313713904.00,United States,,26882,Technology,Computer Software: Prepackaged Software
RDWR,Radware Ltd. Ordinary Shares,$27.62,-0.03,-0.108%,1274944116.00,Israel,1999,134682,Miscellaneous,Business Services
RDY,Dr. Reddy's Laboratories Ltd Common Stock,$70.14,-0.28,-0.398%,11637282449.00,India,,52218,Health Care,Major Pharmaceuticals
RE,Everest Re Group Ltd. Common Stock,$229.33,-1.45,-0.628%,9165327789.00,Bermuda,,127589,Finance,Property-Casualty Insurers
REAL,The RealReal Inc. Common Stock,$20.01,-0.83,-3.983%,1772433914.00,United States,2019,1416478,Consumer Services,Other Specialty Stores
REC,Emles Real Estate Credit ETF,$25.4793,0.0343,0.135%,,,2020,2,,
REDU,RISE Education Cayman Ltd American Depositary Shares,$5.97,0.02,0.336%,336577621.00,China,2017,14432,Consumer Services,Other Consumer Services
REED,Reeds Inc. Common Stock,$0.624,0.00,0.00%,52104996.00,United States,,650933,Consumer Non-Durables,Beverages (Production/Distribution)
REFR,Research Frontiers Incorporated Common Stock,$2.82,0.06,2.174%,89043717.00,United States,,312597,Miscellaneous,Multi-Sector Companies
REG,Regency Centers Corporation Common Stock,$45.31,-0.455,-0.994%,7688206781.00,United States,1993,744874,Consumer Services,Real Estate Investment Trusts
REGI,Renewable Energy Group Inc. Common Stock,$68.91,-5.19,-7.004%,2710417666.00,United States,2012,1203137,Basic Industries,Major Chemicals
REGN,Regeneron Pharmaceuticals Inc. Common Stock,$484.22,1.26,0.261%,51669307154.00,United States,1991,557823,Health Care,Major Pharmaceuticals
REI,Ring Energy Inc. Common Stock,$0.6466,-0.0334,-4.912%,52806917.00,United States,,3116556,Energy,Oil & Gas Production
REKR,Rekor Systems Inc. Common Stock,$7.51,-0.50,-6.242%,247636670.00,United States,,626267,Capital Goods,Telecommunications Equipment
RELL,Richardson Electronics Ltd. Common Stock,$4.60,0.12,2.679%,60755208.00,United States,1983,24786,Technology,Electronic Components
RELX,RELX PLC PLC American Depositary Shares (Each representing One Ordinary Share),$24.95,0.22,0.89%,48206060593.00,United Kingdom,2015,454249,Consumer Services,Publishing
RENN,Renren Inc. American Depositary Shares each representing fifteen Class A ordinary shares,$5.11,-0.10,-1.919%,120492993.00,China,2011,59230,Consumer Durables,Automotive Aftermarket
REPH,Recro Pharma Inc. Common Stock,$2.96,-0.10,-3.268%,69988108.00,United States,2014,638360,Health Care,Major Pharmaceuticals
REPL,Replimune Group Inc. Common Stock,$40.83,0.25,0.616%,1876645364.00,United States,2018,584961,Health Care,Biotechnology: Biological Products (No Diagnostic Substances)
RES,RPC Inc. Common Stock,$3.13,-0.01,-0.318%,673161503.00,United States,,677341,Energy,Oilfield Services/Equipment
RESI,Front Yard Residential Corporation Common Stock,$16.18,0.01,0.062%,950528822.00,United States,,620778,Finance,Real Estate
RESN,Resonant Inc. Common Stock,$2.64,-0.06,-2.222%,143025081.00,United States,2014,3406917,Technology,Semiconductors
RETA,Reata Pharmaceuticals Inc. Class A Common Stock,$129.73,0.43,0.333%,4685296377.00,United States,2016,258273,Health Care,Major Pharmaceuticals
RETO,ReTo Eco-Solutions Inc. Common Shares,$0.63,-0.0371,-5.561%,15205050.00,China,2017,375958,Capital Goods,Industrial Machinery/Components
REV,Revlon Inc. New Common Stock,$12.20,-1.04,-7.855%,650663503.00,United States,1996,189621,Consumer Non-Durables,Package Goods/Cosmetics
REVG,REV Group Inc. Common Stock,$8.96,-0.35,-3.759%,568746779.00,United States,2017,123544,Capital Goods,Auto Manufacturing
REX,REX American Resources Corporation,$74.66,0.19,0.255%,447362869.00,United States,,20918,Basic Industries,Major Chemicals
REXR,Rexford Industrial Realty Inc. Common Stock,$48.48,-0.34,-0.696%,6327876288.00,United States,2013,361961,Consumer Services,Real Estate Investment Trusts
REXR.PRA,Rexford Industrial Realty Inc.,NA,,,,,,0,,
REXR.PRB,Rexford Industrial Realty Inc.,NA,,,,,,0,,
REXR.PRC,Rexford Industrial Realty Inc.,NA,,,,,,0,,
REYN,Reynolds Consumer Products Inc. Common Stock,$30.01,-0.15,-0.497%,6293112005.00,United States,2020,236157,Consumer Durables,Containers/Packaging
REZI,Resideo Technologies Inc. Common Stock ,$21.31,-0.13,-0.606%,3048287224.00,,2018,960287,Capital Goods,Wholesale Distributors
RF,Regions Financial Corporation Common Stock,$15.75,-0.21,-1.316%,15126991000.00,United States,,4173039,Finance,Major Banks
RF.PRA,Regions Financial Corporation,NA,,,,,,0,,
RF.PRB,Regions Financial Corporation,NA,,,,,,0,,
RF.PRC,Regions Financial Corporation,NA,,,,,,0,,
RFI,Cohen & Steers Total Return Realty Fund Inc. Common Stock,$13.05,-0.15,-1.136%,342139837.00,United States,1993,75557,,
RFIL,RF Industries Ltd. Common Stock,$4.81,-0.12,-2.434%,47000997.00,United States,,96461,Capital Goods,Electrical Products
RFL,Rafael Holdings Inc. Class B Common Stock,$24.59,-0.05,-0.203%,389301749.00,United States,2018,27761,Finance,Real Estate
RFM,RiverNorth Flexible Municipal Income Fund Inc. Common Stock,$21.71,0.34,1.591%,0.00,,2020,21872,,
RFP,Resolute Forest Products Inc. Common Stock,$6.51,0.10,1.56%,530784589.00,Canada,,269281,Basic Industries,Paper
RGA,Reinsurance Group of America Incorporated Common Stock,$115.23,-0.09,-0.078%,7828383506.00,United States,,218754,Finance,Life Insurance
RGCO,RGC Resources Inc. Common Stock,$23.83,0.03,0.126%,194707805.00,United States,,7492,Public Utilities,Oil & Gas Production
RGEN,Repligen Corporation Common Stock,$189.02,2.00,1.069%,10342656674.00,United States,1986,244717,Health Care,Biotechnology: Biological Products (No Diagnostic Substances)
RGLD,Royal Gold Inc. Common Stock,$107.55,0.75,0.702%,7055777311.00,United States,,367797,Basic Industries,Precious Metals
RGLS,Regulus Therapeutics Inc. Common Stock,$1.25,-0.07,-5.303%,79380879.00,United States,2012,1285087,Health Care,Major Pharmaceuticals
RGNX,REGENXBIO Inc. Common Stock,$46.48,-1.42,-2.965%,1738744663.00,United States,2015,396140,Health Care,Biotechnology: Biological Products (No Diagnostic Substances)
RGP,Resources Connection Inc. Common Stock,$12.55,-0.10,-0.791%,407037978.00,United States,,110683,Miscellaneous,Business Services
RGR,Sturm Ruger & Company Inc. Common Stock,$64.69,-1.76,-2.649%,1131809771.00,United States,,235616,Capital Goods,Ordnance And Accessories
