Symbol,Name,Last Sale,Net Change,% Change,Market Cap,Country,IPO Year,Volume,Sector,Industry
JAZZ,Jazz Pharmaceuticals plc Common Stock (Ireland),$160.28,0.64,0.401%,8929840882.00,Ireland,2007,339228,Health Care,Major Pharmaceuticals
JBGS,JBG SMITH Properties Common Shares ,$30.60,-0.61,-1.955%,4053419881.00,United States,2017,350990,Consumer Services,Real Estate Investment Trusts
JBHT,J.B. Hunt Transport Services Inc. Common Stock,$136.10,-0.64,-0.468%,14382905776.00,United States,,491079,Transportation,Trucking Freight/Courier Services
JBK,Lehman ABS 3.50 3.50% Adjustable Corp Backed Tr Certs GS Cap I,$29.4866,0.00,0.00%,0.00,United States,,0,Finance,Finance: Consumer Services
JBL,Jabil Inc. Common Stock,$41.85,-0.98,-2.288%,6297235205.00,United States,1993,529159,Technology,Electrical Products
JBLU,JetBlue Airways Corporation Common Stock,$14.68,-0.13,-0.878%,4616252967.00,United States,2002,6322901,Transportation,Air Freight/Delivery Services
JBSS,John B. Sanfilippo & Son Inc. Common Stock,$79.23,-0.43,-0.54%,904777840.00,United States,1991,41746,Consumer Non-Durables,Specialty Foods
JBT,John Bean Technologies Corporation Common Stock,$115.59,-1.55,-1.323%,3667578344.00,United States,,100611,Technology,Industrial Machinery/Components
JCE,Nuveen Core Equity Alpha Fund Nuveen Core Equity Alpha Fund Common Shares of Beneficial Interest,$13.95,-0.04,-0.286%,223608470.00,United States,2007,31554,,
JCI,Johnson Controls International plc Ordinary Share,$45.90,-0.21,-0.455%,33227368158.00,Switzerland,,2436700,Consumer Services,Other Consumer Services
JCIC,Jack Creek Investment Corp.,NA,,,,United States,,0,,
JCICU,Jack Creek Investment Corp. Units,NA,,,,United States,,0,Finance,Business Services
JCICW,Jack Creek Investment Corp.,NA,,,,United States,,0,,
JCO,Nuveen Credit Opportunities 2022 Target Term Fund Common Shares of Beneficial Interest,$8.00,-0.02,-0.249%,221927464.00,United States,2017,220194,,
JCOM,j2 Global Inc. Common Stock,$98.76,0.29,0.295%,4420357657.00,United States,1999,332501,Technology,Telecommunications Equipment
JCS,Communications Systems Inc. Common Stock,$4.46,-0.05,-1.109%,41569319.00,United States,,44444,Public Utilities,Telecommunications Equipment
JCTCF,Jewett-Cameron Trading Company Common Shares,$8.5055,0.0055,0.065%,29609023.00,United States,,1290,Consumer Services,RETAIL: Building Materials
JD,JD.com Inc. American Depositary Shares,$86.14,4.53,5.551%,133506404780.00,China,2014,9683030,Consumer Services,Other Specialty Stores
JDD,Nuveen Diversified Dividend and Income Fund Shares of Beneficial Interest,$8.71,0.00,0.00%,171905063.00,United States,2003,134495,,
JE,Just Energy Group Inc. Ordinary Shares (Canada),$4.66,-0.02,-0.427%,223919193.00,Canada,,792720,Public Utilities,Oil/Gas Transmission
JEF,Jefferies Financial Group Inc. Common Stock,$24.03,-0.18,-0.743%,6107125617.00,United States,,794433,Finance,Investment Bankers/Brokers/Service
JELD,JELD-WEN Holding Inc. Common Stock,$25.31,0.65,2.636%,2550025502.00,United States,2017,824507,Basic Industries,Forest Products
JEMD,Nuveen Emerging Markets Debt 2022 Target Term Fund Common Shares of Beneficial Interest $0.01 par value per share,$7.48,-0.07,-0.927%,106554567.00,,2017,115519,,
JEQ,Aberdeen Japan Equity Fund Inc.  Common Stock,$9.94,0.29,3.005%,133280848.00,United States,1992,11423,,
JFIN,Jiayin Group Inc. American Depositary Shares,$3.07,-0.14,-4.361%,165856750.00,China,2019,348109,Finance,Finance: Consumer Services
JFR,Nuveen Floating Rate Income Fund Common Stock,$8.76,0.02,0.229%,498605780.00,United States,2004,130324,,
JFU,9F Inc. American Depositary Shares,$1.23,-0.13,-9.559%,240084930.00,China,2019,1453018,Finance,Finance: Consumer Services
JG,Aurora Mobile Limited American Depositary Shares,$3.85,-0.08,-2.036%,445533654.00,China,2018,562247,Technology,Computer Software: Programming Data Processing
JGH,Nuveen Global High Income Fund Common Shares of Beneficial Interest,$15.37,0.22,1.452%,356236530.00,United States,2014,66943,,
JHAA,Nuveen Corporate Income 2023 Target Term Fund,$9.57,-0.10,-1.034%,74879738.00,,2018,76844,,
JHB,Nuveen Corporate Income November 2021 Target Term Fund,$9.18,-0.02,-0.217%,513162450.00,,2016,324617,,
JHG,Janus Henderson Group plc Ordinary Shares,$32.51,0.11,0.34%,5897500380.00,,2017,705608,Finance,Investment Managers
JHI,John Hancock Investors Trust Common Stock,$17.4108,0.0358,0.206%,151596271.00,United States,,15508,,
JHS,John Hancock Income Securities Trust Common Stock,$15.67,0.10,0.642%,182501971.00,United States,,11566,,
JHX,James Hardie Industries plc American Depositary Shares (Ireland),$29.41,0.14,0.478%,13062965851.00,Ireland,,11923,Capital Goods,Building Materials
JIH,Juniper Industrial Holdings Inc. Class A Common Stock,$11.00,-0.15,-1.345%,474375000.00,,2019,593180,Finance,Business Services
JIH.U,Juniper Industrial Holdings Inc. Units each consisting of one share of Class A common stock $0.0001 par value per share and one-half of one warrant,NA,,,,,2019,0,,
JIH.WS,Juniper Industrial Holdings Inc. Redeemable warrants included as part of the units,NA,,,,,,0,,
JILL,J. Jill Inc. Common Stock,$4.08,0.15,3.817%,39248988.00,,2017,246287,Consumer Non-Durables,Apparel
JJSF,J & J Snack Foods Corp. Common Stock,$154.06,-2.13,-1.364%,2920319764.00,United States,1986,92335,Consumer Non-Durables,Specialty Foods
JKHY,Jack Henry & Associates Inc. Common Stock,$159.28,-0.43,-0.269%,12155639558.00,United States,1985,315158,Technology,EDP Services
JKS,JinkoSolar Holding Company Limited American Depositary Shares (each representing 4 Common Shares),$65.50,-3.36,-4.879%,2966747110.00,China,2010,3020557,Technology,Semiconductors
JLL,Jones Lang LaSalle Incorporated Common Stock,$150.87,-1.94,-1.27%,7740068372.00,United States,,257086,Finance,Real Estate
JLS,Nuveen Mortgage and Income Fund,$19.57,-0.08,-0.407%,107389201.00,United States,2009,20217,,
JMIA,Jumia Technologies AG American Depositary Shares each representing two Ordinary Shares,$39.92,-0.44,-1.09%,3560729829.00,,2019,8726102,Consumer Services,Catalog/Specialty Distribution
JMM,Nuveen Multi-Market Income Fund (MA),$7.21,0.01,0.139%,68223544.00,United States,,26616,,
JMP,JMP Group LLC Common Shares,$3.8201,0.1301,3.526%,75125884.00,United States,2007,52106,Finance,Investment Bankers/Brokers/Service
JMPNL,JMP Group LLC 7.25% Senior Notes due 2027,$23.97,0.02,0.084%,0.00,United States,,20300,Finance,Investment Bankers/Brokers/Service
JMPNZ,JMP Group LLC 6.875% Senior Notes due 2029,$23.29,0.06,0.258%,0.00,United States,,7435,Finance,Investment Bankers/Brokers/Service
JNCE,Jounce Therapeutics Inc. Common Stock,$6.41,0.04,0.628%,255447955.00,United States,2017,207409,Health Care,Biotechnology: Biological Products (No Diagnostic Substances)
JNJ,Johnson & Johnson Common Stock,$154.14,0.95,0.62%,405780127462.00,United States,,5209007,Health Care,Major Pharmaceuticals
JNPR,Juniper Networks Inc. Common Stock,$22.19,-0.37,-1.64%,7316850139.00,United States,1999,2130022,Technology,Computer Communications Equipment
JOB,GEE Group Inc. Common Stock,$1.025,-0.015,-1.442%,18108801.00,United States,,119558,Technology,Diversified Commercial Services
JOBS,51job Inc. American Depositary Shares,$69.50,-0.24,-0.344%,4684337322.00,China,2004,101691,Technology,Diversified Commercial Services
JOE,St. Joe Company (The) Common Stock,$42.48,-6.47,-13.218%,2501330682.00,United States,,1224210,Consumer Services,Homebuilding
JOF,Japan Smaller Capitalization Fund Inc Common Stock,$8.97,0.13,1.471%,254155020.00,United States,1990,78885,,
JOUT,Johnson Outdoors Inc. Class A Common Stock,$111.00,-0.20,-0.18%,1119412689.00,United States,,26972,Consumer Non-Durables,Recreational Products/Toys
JP,Jupai Holdings Limited American Depositary Shares each representing six ordinary shares,$1.8146,-0.0654,-3.479%,61178000.00,,2015,52784,Consumer Services,Other Consumer Services
JPC,Nuveen Preferred & Income Opportunities Fund,$9.34,0.01,0.107%,965337092.00,United States,2003,372427,,
JPI,Nuveen Preferred and Income Term Fund Common Shares of Beneficial Interest,$24.25,0.04,0.165%,551963732.00,,2012,47654,,
JPM,JP Morgan Chase & Co. Common Stock,$125.01,-0.33,-0.263%,381055864906.00,United States,,8384539,Finance,Major Banks
JPM.PRC,J P Morgan Chase & Co,NA,,,,,,0,,
JPM.PRD,J P Morgan Chase & Co,NA,,,,,,0,,
JPM.PRG,J P Morgan Chase & Co,NA,,,,,,0,,
JPM.PRH,J P Morgan Chase & Co,NA,,,,,,0,,
JPM.PRJ,J P Morgan Chase & Co,NA,,,,,,0,,
JPS,Nuveen Preferred & Income Securities Fund,$9.59,0.06,0.63%,1954248934.00,United States,2002,553448,,
JPT,Nuveen Preferred and Income 2022 Term Fund Common Shares of Beneficial Interest,$24.46,0.19,0.783%,167286343.00,United States,2017,7880,,
JQC,Nuveen Credit Strategies Income Fund Shares of Beneficial Interest,$6.21,0.05,0.812%,842133691.00,United States,2003,1122059,,
JRI,Nuveen Real Asset Income and Growth Fund Common Shares of Beneficial Interest,$13.39,0.03,0.225%,367812320.00,United States,2012,102789,,
JRJC,China Finance Online Co. Limited American Depositary Shares,$10.99,2.52,29.752%,26837140.00,China,2004,800731,Finance,Investment Bankers/Brokers/Service
JRO,Nuveen Floating Rate Income Opportuntiy Fund Shares of Beneficial Interest,$8.65,0.00,0.00%,350681536.00,United States,2004,493998,,
JRS,Nuveen Real Estate Income Fund Common Shares of Beneficial Interest,$8.30,-0.04,-0.48%,239807509.00,United States,2001,119425,,
JRSH,Jerash Holdings (US) Inc. Common Stock,$5.96,0.13,2.23%,67497000.00,United States,2018,20654,Consumer Non-Durables,Apparel
JRVR,James River Group Holdings Ltd. Common Shares,$47.54,-0.52,-1.082%,1455206674.00,Bermuda,2014,150705,Finance,Property-Casualty Insurers
JSD,Nuveen Short Duration Credit Opportunities Fund Common Shares of Beneficial Interest,$13.24,-0.13,-0.972%,133533980.00,United States,2011,41332,,
JSM,Navient Corporation 6% Senior Notes due December 15 2043,$24.41,0.39,1.624%,0.00,United States,,25481,Finance,Finance: Consumer Services
JT,Jianpu Technology Inc. American depositary shares,$2.80,-0.10,-3.448%,59175724.00,,2017,132147,Technology,Computer Software: Programming Data Processing
JTA,Nuveen Tax-Advantaged Total Return Strategy Fund Common Share of Beneficial Interest,$9.35,-0.01,-0.107%,129505887.00,United States,2004,90639,,
JTD,Nuveen Tax-Advantaged Dividend Growth Fund Common Shares of Beneficial Interest,$13.86,-0.025,-0.18%,200752952.00,United States,,93965,,
JULZ,TrueShares Structured Outcome (July) ETF,$28.9485,-0.0563,-0.194%,,United States,2020,750,,
JUPW,Jupiter Wellness Inc. Common Stock,$5.10,-0.18,-3.409%,46829898.00,United States,2020,92834,Consumer Non-Durables,Package Goods/Cosmetics
JUPWW,Jupiter Wellness Inc. Warrant,$0.65,-0.10,-13.333%,0.00,United States,2020,3539,Consumer Non-Durables,Package Goods/Cosmetics
JVA,Coffee Holding Co. Inc. Common Stock,$3.87,-0.10,-2.519%,22092278.00,United States,2005,76739,Consumer Non-Durables,Food Distributors
JW/A,John Wiley & Sons Inc.,$46.10,0.22,0.48%,,United States,,292351,,
JW/B,John Wiley & Sons Inc.,$45.41,-0.15,-0.329%,,United States,,357,,
JWN,Nordstrom Inc. Common Stock,$30.32,-0.72,-2.32%,4780964266.00,United States,,4050072,Consumer Services,Clothing/Shoe/Accessory Stores
JWS,Jaws Acquisition Corp. Class A Ordinary Shares,$13.88,-0.27,-1.908%,1197150000.00,,2020,1368692,Finance,Business Services
JWS.U,Jaws Acquisition Corp. Units each consisting of one Class A ordinary share and one-third of one redeemable warrant,NA,,,,,2020,0,,
JWS.WS,Jaws Acquisition Corp. Redeemable Warrants each whole warrant exercisable for one Class A ordinary share at an exercise price of $11.50,NA,,,,,,0,,
JYAC,Jiya Acquisition Corp. Class A Common Stock,$10.28,-0.3376,-3.18%,141113971.00,United States,2020,21167,Finance,Business Services
JYNT,The Joint Corp. Common Stock,$25.95,0.30,1.17%,364367739.00,United States,2014,66215,Miscellaneous,Multi-Sector Companies
K,Kellogg Company Common Stock,$62.29,-0.05,-0.08%,21409881275.00,United States,,1014483,Consumer Non-Durables,Packaged Foods
KAI,Kadant Inc Common Stock,$136.59,-2.07,-1.493%,1572090800.00,United States,,39086,Technology,Industrial Machinery/Components
KALA,Kala Pharmaceuticals Inc. Common Stock,$6.71,-0.57,-7.83%,376161694.00,United States,2017,4730657,Health Care,Major Pharmaceuticals
KALU,Kaiser Aluminum Corporation Common Stock,$95.38,-0.24,-0.251%,1508164679.00,United States,,86846,Capital Goods,Metal Fabrications
KALV,KalVista Pharmaceuticals Inc. Common Stock,$15.64,-1.14,-6.794%,280615476.00,United Kingdom,2015,121660,Health Care,Major Pharmaceuticals
KAMN,Kaman Corporation Common Stock,$55.93,-1.43,-2.493%,1547996590.00,United States,,99485,Capital Goods,Military/Government/Technical
KAR,KAR Auction Services Inc Common Stock,$18.19,-0.14,-0.764%,2351085731.00,United States,2009,812306,Consumer Durables,Automotive Aftermarket
KB,KB Financial Group Inc,$39.50,-1.47,-3.588%,15588056233.00,South Korea,,118761,Finance,Commercial Banks
KBAL,Kimball International Inc. Class B Common Stock,$12.01,-0.24,-1.959%,444099187.00,United States,,257819,Consumer Durables,Home Furnishings
KBH,KB Home Common Stock,$34.59,-0.48,-1.369%,3384438142.00,United States,1986,681059,Capital Goods,Homebuilding
KBNT,Kubient Inc. Common Stock,$5.27,-0.41,-7.218%,40375051.00,United States,2020,838092,Technology,EDP Services
KBNTW,Kubient Inc. Warrant,$1.65,-0.15,-8.333%,0.00,United States,2020,35715,Technology,EDP Services
KBR,KBR Inc. Common Stock,$29.67,-0.23,-0.769%,4228777663.00,United States,2006,636951,Basic Industries,Military/Government/Technical
KBSF,KBS Fashion Group Limited Common Stock,$2.98,0.21,7.581%,7722071.00,China,2013,236990,Consumer Non-Durables,Apparel
KC,Kingsoft Cloud Holdings Limited American Depositary Shares,$43.44,-0.30,-0.686%,9470691755.00,China,2020,956223,Technology,Computer Software: Prepackaged Software
KCAPL,KCAP Financial Inc. 6.125% Notes due 2022,$24.95,-0.05,-0.20%,0.00,United States,,487,,
KDMN,Kadmon Holdings Inc. Common Stock,$4.07,-0.13,-3.095%,698057686.00,United States,,1471786,Health Care,Major Pharmaceuticals
KDNY,Chinook Therapeutics Inc. Common Stock,$15.97,-0.17,-1.053%,673270159.00,United States,2015,94598,Health Care,Major Pharmaceuticals
KDP,Keurig Dr Pepper Inc. Common Stock,$32.00,0.01,0.031%,45032105408.00,United States,,3084347,Consumer Non-Durables,Beverages (Production/Distribution)
KE,Kimball Electronics Inc. Common Stock,$15.875,0.105,0.666%,399149713.00,United States,,118962,Technology,Electrical Products
KELYA,Kelly Services Inc. Class A Common Stock,$20.65,-0.27,-1.291%,811478094.00,United States,,59098,Technology,Professional Services
KELYB,Kelly Services Inc. Class B Common Stock,$20.22,-0.71,-3.392%,794580487.00,United States,,475,Technology,Professional Services
KEN,Kenon Holdings Ltd. Ordinary Shares,$28.47,0.68,2.447%,1533711897.00,Singapore,2015,2126,Public Utilities,Electric Utilities: Central
KEP,Korea Electric Power Corporation Common Stock,$11.95,-0.17,-1.403%,15342941440.00,South Korea,1994,118708,Public Utilities,Electric Utilities: Central
KEQU,Kewaunee Scientific Corporation Common Stock,$11.73,0.96,8.914%,32407609.00,United States,,5448,Capital Goods,Medical Specialities
KERN,Akerna Corp. Common Stock,$3.41,-0.10,-2.849%,47940191.00,United States,2018,448373,Technology,EDP Services
KERNW,Akerna Corp Warrant,$0.9871,-0.0129,-1.29%,0.00,United States,2018,112389,Technology,EDP Services
KEX,Kirby Corporation Common Stock,$51.21,-0.29,-0.563%,3074597190.00,United States,,194962,Consumer Services,Marine Transportation
KEY,KeyCorp Common Stock,$15.97,-0.28,-1.723%,15594266719.00,United States,,4671765,Finance,Major Banks
KEY.PRI,KeyCorp,NA,,,,,,0,,
KEY.PRJ,KeyCorp,NA,,,,,,0,,
KEY.PRK,KeyCorp,NA,,,,,,0,,
KEYS,Keysight Technologies Inc. Common Stock,$130.01,-1.81,-1.373%,24194088221.00,United States,2014,615940,Capital Goods,Industrial Machinery/Components
KF,Korea Fund Inc. (The) New Common Stock,$39.6902,1.1401,2.957%,199690088.00,United States,,12802,,
KFFB,Kentucky First Federal Bancorp Common Stock,$6.40,0.0999,1.586%,52762976.00,United States,,468,Finance,Savings Institutions
KFRC,Kforce Inc. Common Stock,$42.47,-0.69,-1.599%,932474633.00,United States,1995,116561,Technology,Professional Services
KFS,Kingsway Financial Services Inc. Common Stock (DE),$4.65,-0.01,-0.215%,105606471.00,Canada,,16398,Finance,Property-Casualty Insurers
KFY,Korn Ferry Common Stock,$43.80,-1.18,-2.623%,2362480546.00,United States,1999,293085,Technology,Diversified Commercial Services
KGC,Kinross Gold Corporation Common Stock,$7.33,0.05,0.687%,9223339000.00,Canada,,14443015,Basic Industries,Precious Metals
KHC,The Kraft Heinz Company Common Stock,$34.90,-0.31,-0.88%,42669548563.00,United States,,3322492,Consumer Non-Durables,Packaged Foods
KIDS,OrthoPediatrics Corp. Common Stock,$46.38,-0.62,-1.319%,906943322.00,United States,2017,156581,Health Care,Medical/Dental Instruments
KIM,Kimco Realty Corporation Common Stock,$14.50,-0.21,-1.428%,6271230599.00,United States,,1719074,Consumer Services,Real Estate Investment Trusts
KIM.PRL,Kimco Realty Corporation,NA,,,,,,0,,
KIM.PRM,Kimco Realty Corporation,NA,,,,,,0,,
KIN,Kindred Biosciences Inc. Common Stock,$4.39,-0.05,-1.126%,173180289.00,United States,2013,286601,Health Care,Major Pharmaceuticals
KINS,Kingstone Companies Inc. Common Stock,$6.62,0.07,1.069%,70669811.00,United States,,6616,Finance,Property-Casualty Insurers
KINZU,KINS Technology Group Inc. Unit,$10.21,-0.21,-2.015%,0.00,United States,2020,376224,Finance,Business Services
KIO,KKR Income Opportunities Fund Common Shares,$14.36,0.01,0.07%,292086923.00,,2013,150289,,
KIQ,Kelso Technologies Inc Ordinary Shares,$0.551,-0.049,-8.167%,25990717.00,Canada,,111771,Capital Goods,Railroads
KIRK,Kirkland's Inc. COMMONSTOCK,$18.28,-0.82,-4.293%,260592295.00,United States,2002,792057,Consumer Services,Other Specialty Stores
KJUL,Innovator Russell 2000 Power Buffer ETF - July,$25.8449,-0.08,-0.309%,,,2020,4556,,
KKR,KKR & Co. Inc. Common Stock,$39.43,-0.05,-0.127%,22443126055.00,United States,,1220223,Finance,Investment Managers
KKR.PRA,KKR & Co. Inc.,NA,,,,,,0,,
KKR.PRB,KKR & Co. Inc.,NA,,,,,,0,,
KKR.PRC,KKR & Co. Inc.,NA,,,,,,0,,
KL,Kirkland Lake Gold Ltd. Common Shares,$41.57,0.14,0.338%,11347971734.00,,,1070892,Basic Industries,Precious Metals
KLAC,KLA Corporation Common Stock,$254.36,-3.22,-1.25%,39288399052.00,United States,1980,579207,Capital Goods,Electronic Components
KLDO,Kaleido Biosciences Inc. Common Stock,$9.24,0.02,0.217%,332474650.00,United States,2019,98735,Health Care,Biotechnology: Biological Products (No Diagnostic Substances)
KLIC,Kulicke and Soffa Industries Inc. Common Stock,$31.86,-0.86,-2.628%,1976254581.00,Singapore,,393214,Technology,Semiconductors
KLR,Kaleyra Inc. Common Stock,$9.79,-0.06,-0.609%,287097438.00,United States,2018,136098,Technology,EDP Services
KLR.WS,Kaleyra Inc. Warrants,NA,,,,United States,,0,,
KLXE,KLX Energy Services Holdings Inc. Common Stock,$6.87,-0.45,-6.148%,57895901.00,United States,,82353,Energy,Oilfield Services/Equipment
KMB,Kimberly-Clark Corporation Common Stock,$134.13,0.18,0.134%,45622537583.00,United States,,1044176,Consumer Durables,Containers/Packaging
KMDA,Kamada Ltd. Ordinary Shares,$6.57,0.14,2.177%,293881711.00,Israel,2013,208925,Health Care,Major Pharmaceuticals
KMF,Kayne Anderson NextGen Energy & Infrastructure Inc.,$5.60,0.07,1.266%,264305787.00,,2010,413365,,
KMI,Kinder Morgan Inc. Common Stock,$13.57,-0.07,-0.513%,30716179245.00,United States,2011,14815391,Public Utilities,Natural Gas Distribution
KMPR,Kemper Corporation,$76.26,-0.85,-1.102%,4988045804.00,United States,,71978,Finance,Property-Casualty Insurers
KMT,Kennametal Inc. Common Stock,$35.66,-0.91,-2.488%,2969623301.00,United States,,444216,Capital Goods,Industrial Machinery/Components
KMX,CarMax Inc,$92.24,1.24,1.363%,15038253485.00,United States,,1224461,Consumer Durables,Automotive Aftermarket
KN,Knowles Corporation Common Stock,$18.01,-0.25,-1.369%,1651044724.00,,2014,368289,Consumer Non-Durables,Consumer Electronics/Appliances
KNDI,Kandi Technologies Group Inc Common Stock,$7.16,0.28,4.07%,518223294.00,China,,20671519,Capital Goods,Auto Manufacturing
KNL,Knoll Inc. Common Stock,$14.55,0.21,1.464%,737423871.00,United States,2004,374981,Consumer Durables,Office Equipment/Supplies/Services
KNOP,KNOT Offshore Partners LP Common Units representing Limited Partner Interests,$14.65,-0.14,-0.947%,478968477.00,United Kingdom,2013,170052,Consumer Services,Marine Transportation
KNSA,Kiniksa Pharmaceuticals Ltd. Class A Common Stock,$17.54,0.22,1.27%,1194036114.00,United States,2018,231613,Health Care,Major Pharmaceuticals
KNSL,Kinsale Capital Group Inc. Common Stock,$202.07,-5.93,-2.851%,4582358162.00,United States,2016,322551,Finance,Property-Casualty Insurers
KNTE,Kinnate Biopharma Inc. Common Stock,$38.31,-2.56,-6.264%,1659865760.00,United States,2020,206020,Health Care,Major Pharmaceuticals
KNX,Knight-Swift Transportation Holdings Inc.,$42.22,0.06,0.142%,7170287492.00,United States,2017,1366690,Transportation,Trucking Freight/Courier Services
KO,Coca-Cola Company (The) Common Stock,$54.13,-0.03,-0.055%,232620135548.00,United States,,8318788,Consumer Non-Durables,Beverages (Production/Distribution)
KOD,Kodiak Sciences Inc Common Stock,$146.26,-4.81,-3.184%,7426449348.00,United States,2018,273658,Health Care,Biotechnology: Biological Products (No Diagnostic Substances)
KODK,Eastman Kodak Company Common New,$8.27,-0.10,-1.195%,638140706.00,United States,,6247809,Miscellaneous,Industrial Machinery/Components
KOF,Coca Cola Femsa S.A.B. de C.V.  American Depositary Shares each representing 10 Units (each Unit consists of 3 Series B Shares and 5 Series L Shares),$46.50,0.71,1.551%,9768870009.00,Mexico,1993,51886,Consumer Non-Durables,Beverages (Production/Distribution)
KOP,Koppers Holdings Inc. Koppers Holdings Inc. Common Stock,$29.79,-0.61,-2.007%,627538772.00,United States,2006,241653,Basic Industries,Forest Products
KOPN,Kopin Corporation Common Stock,$2.44,-0.20,-7.576%,207529418.00,United States,1992,1632672,Technology,Semiconductors
KOR,Corvus Gold Inc. Common Shares,$2.47,0.07,2.917%,306249977.00,Canada,,220205,Basic Industries,Precious Metals
KOS,Kosmos Energy Ltd. Common Shares (DE),$2.30,-0.07,-2.954%,932546610.00,Bermuda,2011,4831074,Energy,Oil & Gas Production
KOSS,Koss Corporation Common Stock,$3.44,1.04,43.333%,25472619.00,United States,,15294927,Consumer Non-Durables,Consumer Electronics/Appliances
KPTI,Karyopharm Therapeutics Inc. Common Stock,$14.75,-0.67,-4.345%,1085611461.00,United States,2013,3114775,Health Care,Major Pharmaceuticals
KR,Kroger Company (The) Common Stock,$31.46,0.07,0.223%,23951978508.00,United States,,6463902,Consumer Services,Food Chains
KRA,Kraton Corporation Common Stock,$26.94,-0.31,-1.138%,858628851.00,United States,2009,205937,Basic Industries,Major Chemicals
KRBP,Kiromic BioPharma Inc. Common Stock,$8.72,-0.08,-0.909%,63943751.00,United States,2020,54730,Health Care,Biotechnology: Biological Products (No Diagnostic Substances)
KRC,Kilroy Realty Corporation Common Stock,$55.92,-1.08,-1.895%,6444843525.00,United States,1997,807890,Consumer Services,Real Estate Investment Trusts
KREF,KKR Real Estate Finance Trust Inc. Common Stock,$18.51,0.03,0.162%,1029515612.00,United States,2017,118394,Consumer Services,Real Estate Investment Trusts
KRG,Kite Realty Group Trust Common Stock,$14.74,-0.28,-1.864%,1241160592.00,United States,2004,287946,Consumer Services,Real Estate Investment Trusts
KRKR,36Kr Holdings Inc. American Depositary Shares,$2.65,0.00,0.00%,99360001.00,China,2019,96860,Miscellaneous,Business Services
KRMD,Repro Med Systems Inc. Common Stock,$5.83,-0.12,-2.017%,256187037.00,United States,,306336,Health Care,Medical/Dental Instruments
KRNT,Kornit Digital Ltd. Ordinary Shares,$89.21,-1.93,-2.118%,4039243957.00,Israel,2015,196724,Capital Goods,Industrial Machinery/Components
KRNY,Kearny Financial Corp Common Stock,$10.46,-0.19,-1.784%,936279317.00,United States,,270144,Finance,Savings Institutions
KRO,Kronos Worldwide Inc Common Stock,$14.79,-0.27,-1.793%,1708876784.00,United States,,210215,Basic Industries,Major Chemicals
KRON,Kronos Bio Inc. Common Stock,$30.89,-1.87,-5.708%,1730874939.00,United States,2020,278982,Health Care,Major Pharmaceuticals
KROS,Keros Therapeutics Inc. Common Stock,$74.53,-3.31,-4.252%,1727482500.00,United States,2020,159622,Health Care,Major Pharmaceuticals
KRP,Kimbell Royalty Partners Common Units Representing Limited Partner Interests,$7.91,0.00,0.00%,475249870.00,United States,2017,322151,Energy,Oil & Gas Production
KRTX,Karuna Therapeutics Inc. Common Stock,$102.05,-1.02,-0.99%,2735610060.00,United States,2019,140050,Health Care,Major Pharmaceuticals
KRUS,Kura Sushi USA Inc. Class A Common Stock,$19.19,-0.50,-2.539%,160662921.00,United States,2019,88245,Consumer Services,Restaurants
KRYS,Krystal Biotech Inc. Common Stock,$57.27,-2.12,-3.57%,1128655397.00,United States,2017,71583,Health Care,Biotechnology: Biological Products (No Diagnostic Substances)
KSM,DWS Strategic Municipal Income Trust,$11.36,0.08,0.709%,127276770.00,United States,1989,35294,,
KSMT,Kismet Acquisition One Corp Ordinary Shares,$10.11,-0.03,-0.296%,320992500.00,Russia,2020,74294,Finance,Business Services
KSMTU,Kismet Acquisition One Corp Unit,$10.66,0.13,1.235%,0.00,Russia,2020,221,Finance,Business Services
KSMTW,Kismet Acquisition One Corp Warrant,$1.01,-0.27,-21.094%,0.00,Russia,,14550,Finance,Business Services
KSPN,Kaspien Holdings Inc. Common Stock,$13.56,-0.19,-1.382%,25834485.00,United States,,5137,Consumer Services,Consumer Electronics/Video Chains
KSS,Kohl's Corporation Common Stock,$39.89,-0.24,-0.598%,6288754037.00,United States,1992,3895591,Consumer Services,Department/Specialty Retail Stores
